review,place
"My parents and I decided to head to Ooty for 4 days in April(14th - 17th) to beat the Summer heat. I read many MS reviews on Ooty to know what to expect. I wanted to have a night journey whereas my parents wanted to travel during the day to have a nice view on the way. Finally I gave in and booked tickets for Bangalore-Ooty Volvo starting at 9.30 AM. We also booked the Rajahamsa return tickets since Volvo was full for Sunday night/evening. Journey: On April 14th, we all went to Majestic with lunch and breakfast packed in our bags. The bus started on time. The bus stopped thrice- for breakfast, lunch and tea. All the canteens were horrible n unhygenic as expected. So its better to carry your own food or snacks. A kannada and then a hindi movie(Dil Se) was played in the bus and I was amused to see two foreigners in the bus staring at TV:) Once we reached Bandipur, the journey got exciting. Everyone in the bus was up to spot animals. We spotted many deers, few elephants & some species of monkeys. After crossing Bandipur, we passed by many scenic places. A mild waft of Eucalyptus smell filled the air even though we were inside Volvo and we could feel the temperature dropping outside. The bus reached Ooty at 5.30 PM. Accomodation: We had got accomodation booked at JSS College guest house. This guest house is open only for JSS Collegians' families, but since my father knew someone there he booked it for us. The guest house is very decent, spacious and clean. There was a tv with few channels, a double bed, 2 chairs, a table, mirror stand with table, cupboard, spacious bathroom and a balcony with massive windows. It costed us only Rs. 750/day. Had we booked an accomodation with similar facilities elsewhere in Ooty, it would have costed us a minimum Rs. 1500/day. We also had breakfast and dinner on all the 3 days & 3 nights we stayed there. Food was simple and tasty. For breakfast it was dosa/idli/poha and tea/coffe. For dinner it was roti, curry, rice, rasam & butter milk. They charged Rs. 50/meal/person, but it was well worth it considering food qualtiy and cost in Ooty. Sightseeing: 1) On the first day we opted for Ooty-Conoor package by Impala Travels for Rs.125 each. It covered the following: Ketty Valley Veiw point: Here we can have a nice view of the valley beneath. We can also see through Telescope the church where Saajan movie climax was shot. They charge Rs. 5 for the Telescopic view. Singara Tea estate: The most beautiful of all the places in Ooty-Conoor. It's a huge Tea estate owned by old actress Mumtaz and her husband(lucky Fardeen:). We can take photos there in the tea-plucker's attire for Rs. 40. We can also taste Masala Tea and chocolate Tea and buy tea powder. Doddabetta Peak: This is the highest peak in south India. By the time we reached there, it was drizzling and the view was completely blocked by the cloud. It was beautiful to be amidst clouds and cool breeze. Ooty Lake: It looked very beautiful with the backdrop of massive trees, but it was stinking. So we didn't bother boating. My suggestion- Just enjoy it's beauty from a distance. Botanical Garden: Beautiful and crowded garden. It looks similar to our Bangalore's Lal Bagh. 2) On the second day we opted for Filmi Chakkar package by the same Travels because they have a pick up from our guest house. It costed Rs.125 each and covered Film-shooting spots like the following: Pine Forest: Tall Pine trees make for beautiful viewing. 9th Mile: It has a decent view to offer once we climb up the grass slopes. The grass has turned yellow and dried up now. Pykara Lake: It's dried up a bit and has boating facilities. Rose Garden: Entry ticket costs Rs.20. It did not have many roses so we did not enter. The bus also passed through spots where ""Roja"" was shot and golf club. In the evening we went to Charing Cross and shopped for some homemade chocolates. Now I had high expectations from these chocs and they did not live up to it. I bought a box each from 2 bakeries and both tasted average, much like a choc barfee! We strolled some more and had a pizza in Domino's and returned to guest house. Food: The only good food you can get in Ooty is at Hotel Nahar's 3 restaurants. I had schezwan mushroom noodles and my parents took meals and the bill was Rs. 320 and it was worth it. It is located on Charing cross road. There are many restaurants on this road but a safe bet would be to eat only at Domino's, Saravanas or one of Hotel Nahar's 3 restaurants Since we had one more day on hand, we decided to try Ooty-Conoor Toy Train but we got up late and we were not able to get tickets:) So we decided to go to Doddabetta Peak again since we could not see anything on the first day. It was a clear, sunny day and we spent a few hours at the peak and went back to our guest house. It was time to pack and leave for our 6 PM bus. It was tiime to say Goodbye:( Time to get back to our busy, city lives. The return journey was horrible coz we had got the last row seats and I felt like puking the first few hours. I guess last row seats in Ooty have a thing for my family! Also, there were some unruly school/college guys in the bus who were creating a ruckus and disturbing everyone in the bus. The bus reached Bangalore at 3 AM . Note: Please avoid Impala Travels. They made us sit in the last row seats and reserved middle seats for Tamilians. They did not allow us to sit there even after arguing. They repeated this on the second day too, but we didn't budge this time. They came late on the first day and dropped two spots viz, Catherine Falls view and Sim's Park due to lack of time and hurried us at other spots(within 10-20 mins). They stopped at ""Mahalakshmi"" for lunch which was bad and crowded because many Travels stop here for lunch. A better option would be to grab a quick bite at Cafe Coffee Day in the vicinity. All in all, I would recommend everyone to visit Ooty and Conoor once for the natural beauty, weather and fresh air. It's worth seeing only once because there are many more beautiful places in India to be explored. 3 days are good enough to cover all places. My parents had visited Ooty around 10 years ago and they felt it has become highly commercialised what with houses and lodges coming up everywhere by cutting trees all over the city. If you have the luxury of money and time, hire a car and visit all the places. This way you can stay at those places and enjoy for as long as you want.",Ooty
"Hi Guys! Today I am going to review a wonder hill station Dalhousie which is situated in Himachal Pradesh. I have visited Manali, Shimla but I like the Dalhousie is wonderful place. Its a not so much crowded like other hills station. You will find it so calm and peaceful. I visited it in month of june 2015 and the weather there is so good in morning and evening we feel a little bit dip in temprature. If you are going for atleast for 5 days than you must visit chaurasi temple, khajjiar, pachpula, must visit sach paas where you can see lots of snow even in june. While travel there yoy can see lots wonder scenic views. In 2000 to 3500₹ you can find a good hotel there. I am planning to revisit it coming  year. I also suggest you must go there and enjoy the Switzerland of India",Dalhousie
"Although every place of Himachal Pradesh is amazing and cannot be missed, so is ""Dalousie"". Its a treat for tourists because there are many beautiful places to visit. Its very easy to reach Dalhousie from anywhere in India, you can hire cabs or take buses. There are several places to visit there but most favorite place is ""Daikund Peak"" which gives you a gorgeous view to remember. If you like climbing then you can climb upto 2 Kms and you will find many good paths on your way. An other beautiful place is ""Chamera Lake"", if you love boating then this place is for you. There are several hotels out there so you can find easily a good one( if its not a peak time). There is no issue for safety, you can easily walk on street and enjoy the beauty of dalhousie without any fear.",Dalhousie
"I personally found Dalhousie to be a boring place. I visited Dalhousie on 4th November, 2017 with my family and it was not that good an experience. There is nothing much to do in Dalhousie. Also it is not a developed area, unlike other hill stations. The roads are also not in a good condition and are very narrow. Dalhousie is not the place to visit if you are coming from a far off place like Delhi or Chandigarh. There’s just one place to see in Dalhousie that is, Khajjiar, which is a large field with a little lake in the centre. The lake had already dried. So there was nothing much left for us to see. The whole trip was a complete waste of money. Guys, it is not worth visiting if you are looking for something adventurous.",Dalhousie
"If you would like to get away from Hustle bustle of the city life and enjoy nature and its purest form, then Netarhat is the Place. It has still been able to keep its virginity and simplicity intact. A range of hellocks constitutes ChotaNagpur Plateau in Palamu, Jharkhand and Netarhat is the Queen of them all. The place is still predominantly a tribal area and people here have agricultural, mining labour, and handicraft as their livelihood.It is around 250 km from Ranchi, capital of new state Jharkhand and takes about 4 and half hours in bus. Private car can be hired as well to reach Netarhat. Betla forest is about 150 kilometres from Netarhat.Only Few hotels are available. However, in my opinion,  it is better to book them in advance, before arriving at the Netarhat. Some small restaurants are also available. But besides all these factors the Place is not at all safe which insist me to rate this amazing place as average. You cannot dare to take your own vehical roads are not well built.All the way it's an average  place to hangout with friends or with family. Moreover Don't forget to visit sunset point to enjoy the beauty of nature.",Netarhat
Friends I went to visit dalhousie with my friends . Friends I did not like this hill station at all. The roads in this Hill station are very much broken The hotels here also do not provide good facilities and see very expensive The name of this hill station is the name and nothing to see There is nothing besides seeing the snow here the vehicle facility is not quite good It is very dirty and rotten The dirty in dalhousie hill station is very much cleaned and not cleaned Traffic is very high here There is also fear of stolen goods in the hotels here. Here there is only a lake which in the palm. Friends have to spoil the money to go away here.,Dalhousie
Hey frnds I am back for sharing my experience on Hill station on Netarhat.Netarhat is city Lather district in Indian state Jharkhand. that place is not safe there is not proper hot lel facility who are come from cars and their vanes  .they should sleep in their vehicles because of insecurity. this is not safe for childrens and their is no arrangment of police station thsats it is very dangerous. that place is like as jungle there was a waterfall but did't sweem in it if any one slip he fall on deep water so it was very dangrous and unsafe I suggest dont visit that place because there ia no thing to see,Netarhat
This is good place to trravel long destination from ranchi it is situated in latehar state jharkhand it is best site for picnic in there a great point of view of sunrise or sunset it look very beautiful and charming pepole all around from india came to see the sunrise or sunset and also god of workship there is a good site of valley in travelling there is a dam and good place to celebrate a picnic it takes 6 hours from the ranchi where a great famous school is situated name netarhat which produce jharkhand academic counciling it is a naxalwad area but do not hurt tourist herw a deep forest which make people charming to see a beautiful forest.,Netarhat
"In last winter I with my some friends visited Netarhat, Jharkhand. It is the place of extreme Natural Beauty. It was very pleasant for visiting. But there is so many problem if you go with your family. Because Netarhat is a place of Mouist redder. That's why till this place is not safe for the Visitors. This place may be dangerous in nights. There are few villages in there but all are in forest so Every time I feel a loneliness. There is a problem with Hotels. Only 2 hotels we found in Netarhat. So in winter season many visitors didn't get Hotel in this place. Otherwise there are many water falls in Netarhat which is very Beautiful. That's all about Netarhat.",Netarhat
"It is a beautiful place to visit for adventure junkees, but for me I felt bit uncomfortable there because it was far from city and around that place I spotted only few shops and two hotels, but the waterfalls out there made my day although the place was slippery and not safe for childrens. Accessibility at the place was not so good because it was far from city and the small shops there had no products which I needed. Local sightseeing was good as the place had many waterfalls and there is no restrictions out there so we can go down to the waterfall and swim out there, but it is a risky place for the people who dont know to swim because if we slip there then we will fall directly inside the water. Hotels and accomodations are limited when I went there, I spotted ony two hotels, not sure if more was there and the facilities in the hotles are not upto the mark, but considering the forests around the hotles were good, the water facilities and electricity was 24 hrs active, but we had to compromise on food, as they had a limited menu, we can only order from the available items. As per safety measures in that place I dont think it was fully secure for a tourists to feel free, before reaching there few peoples were talking about the theifs who stollen the items of tourists, but we did not experience such things there and the waterfalls was not safe, which is our responsibility to stay as much away as possible and enjoy the beauty of nature from far.",Netarhat
Netarhat is the tourist place present in jharkhand. This place is present in Latehar district of jharkhand which is about 40 km from Latehar main town and approximately 140 km from ranchi.it is the place where always feel like cold and people can enjoy be seeing sun nearest to their front. Netarhat is popular for nearest sun rising and cold place of jharkhand. There have series of hills that make it attractive. A netarhat school present their which is famous in jharkhand. Netarhat is really a tourist place,Netarhat
"Me and my friends visited Dalhousie in 2016.We were enchanted with the green lush vegetation and the mesmerizing view of the Himalayas.We stayed in Dalhousie for 2 days and in this 2 days we hired a taxi to visit Khajjar(mini Switzerland), Kalatop Wildlife Sanctuary, Dainkund, and many more.Walking on the streets of dalhousie features the surrounding beauty of the hill station.Most of the restaurants and eatery are present in the Gandhi Chowk which is in heart of the city.",Dalhousie
Before 2months I have visited to this place so on behalf of my personal experience I would like to share with you as a review. There is no good accessibility in this place and it is very dangerous place. When we talk about the local sightseeing it is a little bit nice but not so amazing as you could expect because we can't see sunrise properly here. The main problem is there is no proper hotel facility usually peoples who come with their car & Van they should sleep inside only because of insecurency of the place. This place is very dangerous and not so secured there is no proper police station near this place. So by observing of these things I would like to suggest you all please don't go here because it is a very dangerous place.,Netarhat
"I am going to share my experience about this hill station. It is a place to visit in all the month of the year. But I prefared summer. Netherhat is a city in Latehar district of the Indian state of Jharkhand. Referring to the queen of chhota Nagpura, it is a popular hill station. The first thing you should do is not to forget to see the sunrise early in the morning. Once you refresh, you can spend the rest of the day in the different waterfalls. In the evening, make a point to give Magnolia Point, which is ten kilometers away from Netarhat, to give a testimony to the spectacular sun. Yo can pass your time in nature or visit the places like Netherhat School and the Netarhat Dam. Neharhat is a plateau region and there is not much in terms of food. Around this area, small restaurants generally mix Bihari and Bengali dishes. Hotel facility is not available here. One or two small hotels are available which are always crowd and rooms are not available. No hospital as well as Police station available near it. So this place is not good in security prurpose. Like and comment on above review.",Netarhat
"Hello friends , I am giving review and my true experience on Netarhat a place where no facility available for our safety .Anytime , anything can happen .There is no hotel facility to stay their and enjoy lonh time , no police station near Netarhat for help and support .This is a open place sourrounded with so many long trees. Wild animals also come their anytime and give harm to us.No guard their for guide and help in night.Also main thing is tha no proper sunshine can see . Accessibility is very far from my region and this is one side place , their is noone near this place. Local sightseeing is also bad.Only trees are their to see only in day time.No sunshine can see because of so many trees. Hotels / accomodations , ni hotels their for stay in night.one who go with their cars they can stay and sleep . No safety facility their for visitors , no guard in night and propers instructions , no police station near .",Netarhat
"I visited this beautiful place with my family. Speciality of netarhat(known as choranagpur) is the beautiful sunrise and sunset views.we enjoyed here because it is a place which filled with natural beauty.we enjoyed sunset at magonilla point which is an amazing plays for sunset views.there are lots of water falls here. Availability of chemist shops are very poor.this makes difficulties to the people who came here without medicines.we suffered lot. Availability of accommodation is average and netarhat is not linked with other important cities. In my opinion, it is not a safe place to visit because maoist threats are existing here. It is a perfect place to enjoy the natural beauty but not a safe place! Thank you",Netarhat
"Nothing to see their Only the thing to see is khajiyaar which is some km away from it better than dalhousie Khajiyaar has a big area . A green ground And a place covered with tall trees and their is also skydiving So my advice is to say no to dalhousie it has nothing to see only a waste of time So, visit anywhere else rather than it",Dalhousie
"I would like to share my personal experience with Netarhat, the tourism place. I went their with my friends 2 weeks ago. We went their for a tour. We reached there at 7 a.m.  I was excited to see that place because my friends tells me that this place has s natural beauty and looks very beautiful. When we reached there, we looked for a hotel because we were staying there for 3 days as planned But there were shortage of hotels and this place is far from city. We found only two hotels there and they charged a lot. But we needed a hotel so we paid xtra money. When we went out to see that place after taking rest in hotel, I found that it is not beautiful as my friends told me. This place is like a jungle . there was no thing which can we see. There was a waterfall but we didn't swim out as if anyone slips from there he fell into deep water. This place is not suitable for children as they are not safe there. I suggest that not to visit this place bacause there is no thing to see like.",Netarhat
"I am will impart my experience to this slope station. It is a place to visit in all the long stretch of the year. In any case, I favored summer. Netherhall is a city in Latehar locale of the Indian territory of Jharkhand. Alluding to the ruler of Chhota Nagpur, it is a well-known slope station. The principal thing you ought to do isn't to neglect to see the dawn at a young hour early in the day. When you revive, you can spend whatever remains of the day in the distinctive waterfalls. At night, influence a point to offer Magnolia To point, which is ten kilometers far from Netarhat, to give a declaration to the marvelous sun. You can take a break in nature or visit the spots like Netherhall School and the Netarhat Dam. Neharhat is a level area and there isn't much regarding nourishment. Around this territory, little eateries for the most part blend Bihari and Bengali dishes. Lodging office isn't accessible here. Maybe a couple little inns are accessible which are dependably group and rooms are not accessible. No healing center and also Police station accessible close it. So this place isn't great insecurity reason. Like and remark on above audit.",Netarhat
"I have visited Dalhousie last months with my family.  I have gone their from New Delhi, by train, the nearest railways station is Pathankot from where I take private taxi for reaching Dalhousie.  I arrived their in the evening where I have already booked a hotel there which provide us very good and comfortable room and there was also a restaurant on the roof of the hotel, I enjoyed there very much.  The weather of Dalhousie was very cold and on the same night there was a nice snow fall started.  When we wake up in the morning all the hotels, roads and greenery of nearby covered with full of white snow.  The weather becomes very romantic and pleasant. I enjoyed the snow fall there very much.  I have stayed there four days.  I visited the places of interest like Dainkund Peak, Khajjiar, Dalhousie cantonment, Punchpula, Tibetan Market and thereby local market. This place was less populated and rare township.  There was greenery and forests all over the town.  The view of this place during snowfall is very attractive and enjoyable. Whereas I think this place is very special for honeymoon couples as the place is very calm and romantic.  On that time many honeymoon couples are stayed and moving all over this place. I am giving some details of Dalhousie and Kajjiar for information of the person who is making plan to visit this place.  Dalhousie is a hill station in Chamba district in the state of Himachal Pradesh.  This town was named after Lord Dalhousie, who was the British Governor – General in India and it was established as a summer retreat for its troops and officials.  The best time to visit this place is summer(May to September). Khajjiar is located approx 24 km from Dalhousie.  This is surrounded by meadows and forests.  It can be reached within one and half hour from Dalhousie.  It has a rare combination of three ecosystems – lake, pasture and forest.  Its nickname is Mini Switzerland of India. It is very important to note that whenever we visit Dalhousie, Khajjihar must visit. Without visiting of Kajjihar the trip of Dalhousie is incomplete. I have hired a taxi from Dalhusie to Kajjihar and reached there after one and half hour, the seen of Khajjihar is the awesome.  There was snow fall all over the place there. The view was amazing.  The trip was very exiting and interesting I strongly recommend all the lover of visiting interesting tourist places must visit the place.",Dalhousie
"Hello guys, Few days ago me and my friends go to Zarkhand. And we stand for 1 month in zarkhand. So we was going many places after 15 days in Zarkhand we was going to netarhat. My friend is recommended this place. So we was visiting this place but I don't like this place. Naturaly this good but no facilities is available like hotel and restaurant. Netarhat is good clean place Sefty problems is also available no police is present there. Hotel availability is also zero. So I am never going to netarhat and I am never recommended this place.Thank-you",Netarhat
"Everybody love hill stations, so do I came to know about Netarhat in Jharkhand. It is famous for the sunrises and sunsets in summers as it is located on a plateau.  Also, the place felt quite small due to fewer places of tourist interests, being Magnolia Point known for sunset; Upper and Lower Ghaghri Falls, Lodh and Sadni Falls and also Koel View Point. Among which Lodh(around 60 km)  and Sadni Falls(around 40 km) are a little far from Netarhat( but not far enough for an enthusiastic traveler). These were the Pros of the place but as an individual, the most important thing is safety, which not good in Netarhat. The accessibility in the place is not well structured and one might find issues traveling safely. The population seems minimal while traveling and Local sightseeing doesn't offer more than some dense forest with a lot of oxygen as the gift. Accommodating yourself might go from acceptable to even difficult situations. As far as safety is regarded you could not expect much(As the place has a bad reputation). As a Tourist, I would only suggest others that do a good research, plan your accommodation and travel, and also be aware what are signing up for before going to this place. Thanks!",Netarhat
Hello friend today I share my wirst experience with you On 23 jan 2018 I reached to netarhat with my family to attend a function the road are full of holes and broken also transport pollution was there it cunsume too much time to reach The very few people are there near road The after 5 pm it get dark also no good hotels we stay in lodge no room service was there I feel unsafe in that place no police on roads and people are mostly uneducated in that place Overall I suggest other to takecare of you self,Netarhat
