review,place
"Hello friends, I would like to share about the  lord vithoba s place of Pandharpur . Pandharpur ""s called of South KAshi . I was panned many years ago for visit at pandharpur, but we cannot mannage the visit at pandharpur because my office  work, but this time, I was fully planned going to pandharpur.  and we can done with family  and give darshan of lord Vithoba""s . its nice place, this place temple of vithoba situated at Chandrabhaga river . its major holy place in a Maharashtra its temple femous for vithoba temple this situated at bhima river , bhima and chandrabhaga also same name  and same name in a pandharpur . its safty for family and each other . good place, good climate in a pandharpur . I recommed to all, please visit this holy place . thanking you",Pandharpur
"Baralikadu Tourist place is very popular. This place accessibility is good and I like this place, I come here with my friends in last month. This place is very attractive and good for summer holidays. This place location is good and natural looking is very nice. This place is not any good natural local sightseeing near of this place. This place have long distance with developed area so no any many hotel near of this place and good transport links with other city and places. This place have many transport service for going other places. This place is natural place and spread in long area so security is not proper work in this place and disturb many time but maintenance is not good. This place is good for holidays but not for a long time.",Baralikadu
I really like  this place its awesome nice wonderful area it is good to go there in summer because this area is full of cold everybody enjoy it because person can go who have depression job tention etc will get a relief because it is more nature beauty and in morning we can see snow over there sometime we can see wild animal there,Kakkadampoyil
If you visit MP and Miss chindwara than you have not seen anything. Parineeti Chopra's favourate destination. Main places to see here but Deogarh fort is main attraction. Hotels are easily available here. Safe,Chhindwara
"Its a must see place in andaman trip. Scuba diving, and snoorkelling are main attraction. The Radhanagar beach is wonderfull place to play. clean and safe. The packages only covers this. You have to pay extra for other places like kaalapattar beach, eliphanta beach etc.  Nothing much in Kaalapattar beach you can take some photo. But you must visit eliphanta beach for fun Water games. ( Travelling  costs you rs. 750 per person) Special  Banana is famous fruit dont forget to eat. The agents/people in havelock are roude, rough and money minded  compare to all other part of andaman. If you are pure vegitarian, food is major issue, but if you search you get one or two.  Tour is enjoyable if visitted in group. Hotels are available but book prior of visit. Keep an eye on weather as it is not safe during cyclones. Totally the island is bit costlier than other places nearby.",Havelock Island
Hi friends. Recent in may me and my family are visiting the tuljapur . Its so great place. In tuljapur having no direct railway tracks. By using buses we going safely or you are used your private vehicle also.i am going to our own vehicle. Their are climate are warm in summer season. The great and important place is temple of tuljabhavani. The story is that their was temple already but in Shivaji Maharaj mother says for success pray for tuljabhavani . And  that time tuljabhavani gave as talavar. Then after getting success Shivaji Maharaj construct jijau mahadvar. The get of tuljabhavani Temple. Its so beautiful .after get the ganpati temple then tuljabhavani stactu are their. The most beautiful that. For entry so long line are completed then going inside the temple. So types of People come there to see . Ans tutrist also their . For enjoying or seeing only that one place their no other spots . The many types of hotels and restaurants are available. For tutrist safety the police also their. This is family spot . And I love this spot. You also visit their. And see the historical time temple.,Tuljapur
"Hello friends I am going to share my views on the beautiful hill station manali.it is the most beautiful place of india.i have visited manali last month with my family and the experience was amazing.i have first time visited manali and its like heaven. Its a amazing place especially for the couples. Its is also known as  indias favaurite honeymoon destination. There are many point of attrection such as Rohtang pass, solang velly, Hadimba temple and rahala falls . The mountain and peeks looks awesome.The grenery on the mountains looks beautiful.The snow on the mountians looks very amazing and it shines like a silver on the peaks .",Manali
The fort is close to pune which is good . It is a good place for trekking. A early morning departure from pune and you might be back till 5 in the evening. The place needs maintenance . It is not fully intact but nine of the fort in india is fully intact. If you choose trekking then its ok but if you decided to ho to the base of fort by car or any vehicle the roads arent good . You can get high amount of traffic,Sinhagad
"Hi friends. Now I'm going to sharing my peaceful experience about kodaikanal. I gone to this hills station more than 3 times. We go to All the summer season. First of all kodaikanal is easily to accessible by bus, car, train. First we are gone to visit the BERIJAM LAKE. The lake was so different, excited with different climate. And then we gone to kodaikanal lake this lake also nice. Silver cascade falls, Bryant park , pillars rocks view point, kumbakkarai falls, chettiyar Park and moir point. The hotel and accommodation are so good. we stayed at GRAND PALACE hotel just 1km in centre of kodaikanal. Nice service, good lighting, room cleaness is good. The accommodation is just 2500rs only we have provided breakfast for all and we services are very good. The safety is better than the other hotels also All the friends and family members are just go and visit to the beautiful city of kodaikanal.",Kodaikanal
"Sinhagad is the best near by tourist place near by Pune it is only 37 km from pune.easly any one can go by bike and it is the best option to reach there. sinhagad is around 2000 years old fort.it has its won history. best time to visit sinhagad is rainy season. I visited this place many time with my friends, family. you can reach up on fort by stares or trek both options are available. in rainy season it is almost covered by fog and it continuously drizzle.with cold wind.in short weather on sinhagad is amazing.romantic, it is situated quite at height  and it is foggy so it feels live you are in clouds it feels awesome. there you can get variety of food.veg and non veg both in veg one special and yummy item is zhunka bhakar with thecha.and in rainy season kanda bhaji with tea while it is drizzling I advice every one should visit this place once in life time.",Sinhagad
"Hai friends I want to share here my experience from the place kodaikanal. Kodaikanal is the very coolest and very relaxing place in thamil Nadu. Everyone day thousands of people are coming there to enjoy the climate there. I went there many times with my family and friends as well. But the main problem is to reach there. It is full of hair pin roads and very difficult for driving. Many accidents had happened there because of the invisibility of the opposite vehicles . There the airport facility is there but from there again have to take the same roads to reach there. Some roads are with full gutters and chances are more for accidents. The local sight seeing good. We can see many of places with natural beauty. Many gardens, suicide point, museum, boating, ropeway etc are there. But there the roads and surroundings are not cleaned and hygiene. People are polluting the roads like anything. The tourists places are not maintaining properly. So for kids this place is not comfortable. The facilities for trashing is not good. The charge for some spot seeing is very costly and not worthful. Many hotels and restaurants are available there. But they are charging by seeing the customers. There is no fixed rate for the food and rooms. So we should have to compare it very well before deciding the hotels and restaurants. There it is very safety place only. The people are  very helpful and coperate. But at the place of boating,  I could not felt any safety measures. So overall I am not happy with this tourist place mainly because of polluted surroundings.",Kodaikanal
"People in Kodaikanal urinate in the public places without having second thoughts. Whether it is near the lake or the main road or the places where people walk around. Government has provided with public toilets, which people should really use. Most of the tourist places are stinking of urine badly. If this is the case how foreign citizens will think about?",Kodaikanal
"Let me tell you what you will get to see here The temple is located near the beach. Although the beach is not that clean. There is a boating facility which I am sure we all enjoy. Infrastructure of the temple is Just Awesome. In the evening the Sunset scenery is out of this world. The hotel facility is decent. In the evening you will always find an atmosphere of festival which is really cool. All in all, the place is really good.",Murdeshwar
I have been to agra in 2016 to see taj mahal with a few friends. I deborded there at 11 in the morning. And took the auto for taj mahal which wasn't far away from there. We went there but the auto driver wasnt nice at all. He was trying to portray an image of agra Wala's that they are richest and coolest. Any way we went to tajmahal but it was not open for general public for that time. So we thought to go around. And fixed a deal with a cab driver to go a little siteseeing. He said he will take us to meena bazar famous market there but took us to a local shop there in a different street there. Again he was traing to make a fool out of us. And such thing kept happening all day. Bottom line is agra people are not kind or generous or even humble. If you go there be aware of your surroundings and do research.,Agra
"I went to kodaikanal around 6 months back with my friends. We were 6 in number and visited in the month of may. We went in bus, first from my place ( kerala) to bangalore and then from bangalore to kodaikanal. When I reached there the weather was cold and since it had rained a day before. We stayed in the nearby cottege. The location of the cottage was so beautiful and felt as if I was living amidst the cloud. Best for sightseeing We booked a cab to roam around the city. We covered vatican falls, guna cave, pillar rock, mannavur lake, dolphin nose, suicide point. We also went for boating in the lake and cycling around the lake. The view from suicide point and walk in the guna cave was excellent. It was a wonderful experience. Next day we went for trekking amongst the beautiful hills. The weather was bit cold, but was a great experience. All the sceneries were super, took a lot of photos and enjoyed our time. The stay at the cottege was good. The food was excellent.",Kodaikanal
"Sinhgad is the fort located in Pune district Haveli taluka. It is the fort in sahyadri mountain having near about 1300 meters above sea level. The fort is built almost 2000 years ago and having its own history. This fort is named as Kondhana before the war of Tanaji Malusare and udaybhan. After that war named is given as SINHGAD by the King Shiwaji. We can reach to the fort by Bus or private vehicle. For train and plain nearest station is Pune. From Pune we can reach at the fort by cab or public transport. If we go from private vehicle we can reach up to the top of mountain. If we go from the public Bus we can reach at the base point. For fort seeing we required at least 2-3 hours. there are two main doors for entering the fort. There are not big hotels at sinhgad but we can get food on stalls at fort. Main food course on the fort is same and popular. The Kanda Bhaji, Zunka bhakar, Curd on the fort is famous. many peoples are coming on fort for the delicious food. Sinhgad is more attractive in rainy days.",Sinhagad
"KODAIKANAL is one of the very Popular Holiday Destinations of South India. It is referred to as the ""Princess of Hill Stations"" and it stands 7200 feet above sea level resting on the upper Palani Hills of the Western Ghats near Madurai in Tamil Nadu. History states that this is the only Indian Hill Station developed by the Americans. Now here are some of the Pointers on how to get in to Kodaikanal. > BY AIR: Madurai( 120 kms) , Coimbatore( 170 kms) and Trichy( 150 kms) are the nearest Airports to Kodaikanal. Direct Bangalore to Kodaikanal flights are unavailable. Those who are keen on flying can opt to take a flight to one of these airports and then opt for the roadways. > By RAIL: Kodaikanal Road Train station is nearly 85 kms to Kodaikanal. There are many direct trains from Bangalore to Kodaikanal and the known one are the Tuticorin Express and the Nagarcoil Express. > By ROAD: Kodaikanal is very well connected with all the major Towns via roadways and a good number of Buses are available. The Bangalore to Kodaikanal distance of approximately 470 kms and can be covered within 7 hours with steady driving. Self Drive is a good option so that the journey will be more comfortable with rest stops and local sight seeing on the way. The road is tarred and broad and is safe even at nights( what I felt) . Now Popular Sightseeing Places: KODAI LAKE > The Kodai lake, a man made structure of circumference of more than 5 km, is a beautiful place. Cycling, horse riding, walking and boating are the various activities that can be done there. BERIJAM LAKE > This lake covered almost by forest should be definitely at the first of the to do list in Kodaikanal.  Limited number of cars only allowed every day and we were told about 50-75 cars only allowed as per permit from the Forest department.  Rs.200/- will be charged as entry fee at the check post and a form needs to be filled. COAKERS WALK > Named after an Englishman Coakers walk is a one kilometer walk near a church. Located at height of 2150 metre this is a very good spot for a nice photo shoot with family over looking the Kodai Valley. PILLAR ROCKS > Please do not miss this view point. If you are lucky enough and there is not dense fog you will be able to see the two rocks which looks like pillars. Please be careful about the monkeys as they are very cunning and are very good at snatching things. GUNA CAVE > Trust me you will fell in love with this place. The small walk/trek from the counter gate till the caves is also great. These caves, earlier known as the ‘Devil’s Kitchen’, have now been fenced off due to the some unexpected accidents. But this is a great place for the Selfie Lovers. There are other places to be seen such as: Pine forest, Kurinji Andavar Temple, Poombarai Village View, La Saleth Church, Moir Point etc. Now where to STAY: There are many option for staying at Kodaikanal. Good and Budget hotels are available, the only thing we need to have a check is the availability. The best thing I love to have in Kodaikanal is the IDLI SAMBAR near the bus stand. An elderly couple will be serving hot IDLI, VADA and other stuff and it really taste great. Any one can get the taste from 6.30 AM till 11 AM. The best things that can be purchased for ourselves and our loved ones back home are the Home Made Chocolates, Tea Powder and a variety of Herbal oils with medicinal values. Now to conclude my review I will use my Title line, Indeed Kodai is an Awsome and evergreen destination which everyone should visit once.",Kodaikanal
"Well known Eco park is situated at Rajarhat, Newtown, North 24 Parganas. Just 500-600 m from Narkelbagan and Nearest to the Mothers Wax Museum. It is open till night 8 pm and public vehicles are always there. You can view mother wax museum and the Kolkata Gate when you visit eco park. This Park is maintained by WBHIDCO govt of West Bengal. Withing few years of it establishment it has become popular among families as well as youngsters as because of pleasant atmosphere and calm place near the Tilottoma. The 480 acre park is surrounded by 104 acre water body which is the most attraction of the park. There are 2 parking lots. Lots of views, hangouts, fountains, trees grasses. At the center of the park there is an island. The land portion is well maintained clean filled with grass, pedestrian zigzag roads. There are rides of two seated bicycle, pedal boats, water plays etc Every day there occurs an open air water show(fountain theater) which is amazing. For couples there are lots of place to walk and talk places. To spend some romantic moments the park is beautiful. The dusky evenings are not less than a haven. Any one can also book the Lonely island called'Ekante' to spend some hours to feel  lonely island in the midst of busy Kolkata. Rest when you visit. Thanks.",Eco Park - New Town - Kolkata
Hello friends today I share my picnic experience with you On 12 nov 2017 I reached to kolkata with my family we already booked the hotel from bhilai by sanjay tours and travels we stay 2 days in hotel amit international room was good well clean and maintained 24×7 water facility was there which I like it Food was not so expensive I can afford it We hire car also bus was avialable so it is easy to access are 2 hours to reach The palace is situated between two rivers We hire boat fare to reach Great spot to sit on trees we enjoy swiming water was not so deep around ten feets Great breeze come on day time I love it Overall I spend  great time there I suggest others to go once in life,Machranga Dweep (Kingfisher Island)
Daltonganj is one of the best city who improved day by day vary fast. daltonganj city satuated in jharkhand in palamu these city population about 150000 . daltontonganj have also a another name is madininagar .i am also a datonganj citizen and I love my small city daltonganj .these city has much secure and safe for womens. thanks.,Daltonganj
"I just took opportunity to write a review on Goden temple located at Sripuram in Tamilnadu state.This is Lakshmi Narayani or Mahalakshmi temple coated with gold both interior and exterior.About 1.5 tonns of gold has been used and Rs 600 crore is spent to build the temple covers 55, 000 sq ft. We started our journey from Bangalore(Vijayanagar)on Saturday 11.00AM in my Swift. It was 12:30 when we reach Narayana hridayalaya due to traffic. I took 10 mins break then drove towards Hosur. This is NH7 neat road with cat eyes erected and borders are painted with white color, this helps a lot during the night driving. After driving about 45 kms, there is a toll plaza, near Krishnagiri, pay Rs25(One way) Next there are 2 flyovers, gon’t go over the 2nd flyover. Take left side lane, drive for a km, you get signal and take left(towards Chennai/Vellore) leaving behind the NH7, now you are on NH46. There is one more Toll plaza near Ambur, paid Rs 35, keep drove for another 10 mins.It was 2:30PM feeling hungry, found a hotel on the way(LHS), Motel Rosin, we had lunch, food quality was not good but there were no other options. We continued our journey and drove till Pallikondaj Toll plaza, paid Rs 45.When we were near to Vellore(5Km), I found a sign board to Sripuram.I asked a local person how to reach the Golden temple. He suggest 2 routes. One from Vellore the distance will be 13 Kms. And the 2nd route(Just 5 KMS) is from the same place where we asked him for the route.(I am sorry, I don’t remember that place.) I decided to take 2nd option because it was 4:00PM and if I go Vellore city, it may take more time due to traffic. Road was very narrow but good, there are 2 -3 small villages on the way and need not to ask anybody about the rout. Because once they spot the car, they show you the rout even before you ask them. They knew those vehicles are heading toward Golden temple. After driving 3 Km, mud road starts and drove for another 2 Km. We reached the backside of the temple and drove along the compound wall till the main entrance.There were many Pay –n – Park sign boards on the road. For safety reason, do not park anywhere, but go the temple premises pay Rs 10 and park your vehicle. Temple timings: 07:00AM to 9:00PM(queue will be closed by 8:30PM). Restrictions: Mobile phones/cameras not allowed. Need to submit at the special counter and get the receipt or keep them in your car. Girls with mini skirts(even if the age is 6-8 Yrs) are not allowed to enter the temple. In this case, you need to buy a cloth from the nearby shop located in temple premises(security persons will suggest where to buy and what to buy). With Free Darshan, you have to walk through the queue complex just like in Tirupati, It will take 2-3 Hrs.With Rs 150, you will skip the queue complex and directy enter the temple, but you need to walk through the star shaped path to reach the main temple.With Rs 250 Darshan, you will be allowed to sit for 10 mins in the temple near to Amma and offer special pooja. You have to pass through the two levels of security check inside the temple. People should walk through the star shaped path way to reach the temple. It is about 1.5 KM.The messages of'Amma' and quotes from Bhagavad Gita, Bible and Quran are displayed On either side of the pathway. Though the people's focus will be on the temple in gold. Temple is surrounded by water; I found coins, notes and even some visiting card thrown in water. We took Amma’s darshan and there for 15 minutes in the temple.After receiving Prasadam, we moved out of temple and walk through the star shaped path way. On the way back, you will find Tea stalls also. It is worth to pay a visit. The landscape, beautiful scenery, good atmosphere, greenish lawns, fine architecture and 2 tons of gold all combined makes one feel worth of the visit. There is huge, well maintained restaurant in the temple premise.",Sripuram
At starting of every winter I always visit eco park for picnic with my friends and family.So here is my review about the park. If we talk about the accessibility of the park its very big park and have many things to explore there first of all park is decorated with flowers plant and some kind of rare fruit plants again this park also include some staffs which makes ur picnic memorable like cycling boating and other water and land based rides. If we talk about local site seeing we can find here dummy sets of seven wonders of the world and many other things like water musical fountain which entertain you fully. Hotels inside the park is quite expensive but as the maintenance of the park is quite well its worthy to spent some extra money. Park is save and secure because it's under 24×7 cctv surveillance and have many security guards to take care of the park. It is the best park in the city and I recommend everyone to visit this park for picnic.,Eco Park - New Town - Kolkata
"Daltonganj is a more developing town  among the towns of the jharkhand state. it is also known as Medininagar. it is basically, located on the palamu division in the district of palamu. it is 18th centuries established town in palamu district. Daltonganj is situated on the approxmately 180 kms. away from Birsa Munda Airport in North-west direction. it is approxamately 170 kms. away from ranchi the capital city of jharkhnad via NH39. in this city has a chianki hawai adda and a bus stand from where the transpotation system is running to the almost all cities & towns of jharkhand as well as its neighbour states like bihar, chhattishgarh, west bangal, orrisa & utter pradesh. it has a small railway station with poor accessability of trains but only few trains manage the crowd population of this city in lackadaisial way. from the Daltonganj railway station no one  taxi or cab facility are available to pick up. only private four wheeler & auto pick up the travellers with no safety, because of road are very poor, so there accident is likely to seen usually. In Daltonganj only a few sight that is likely to be seen like palamu old fort and Betla national park. palamu old fort is located on around 20 kms. south east of daltonganj. it is a old & famous place of chero dynasty. Betla national park is a famous national park i.e. located in latehar district around 24 kms. away from daltonganj via NH39. it is scattered in around 1 kmsq. it is known as india's 1st tiger reserve. LX INN Hotel & resturant, hotel manas, hotel jayashree, hotel nirwana, hotel chandra residency and like on hotels are available in daltonganj. in these hotels faciltiy are poor to average. foods & beverages items are limited comparative to other towns even also quality is poor. these hotels have a small parking facility and not safe to stay. presently, Daltonganj is not the safe place to freely move in the town. according to news reports many crimes have been committed in around a day. law & order system is almost dead.",Daltonganj
3 days ago I have been to kolkata.At evening I had to return so I was searching a place to spend some time someone suggested me to visit Eco park so I went there. This park is very good and eco friendly park. Accessibility is good lot of plants and flowers in the park can attract people. Different varities of flowers and plants you can see there. The park is safe for visitors as cctv camera is there. Local sight seeing is good there is a dummy of seven wonders in the park which looks great. Restaurants inside the park is quite expensive. The park is well maintained and clean. The best thing is there is so much space outside for parking Overall it is a good place to hanging out with friends.,Eco Park - New Town - Kolkata
