review,place
"Agra is well known city of india. It is very historical city and there are various story and monuments in agra. Agra is situated in UP and it is very near to capital New delhi. So the accessibilty to agra is very good.  You can reach agra by air , by train and also by road. It is the main railways route of central india so therw are many trains. There are various local sights but The main attraction of agra is THE TAZ. Tajmahal is one of the wonder out of 7 wonders. Sikandara is also very famous place to visit. Local garden near taz at the river yamuna is very atttactive and peaceful.the agra fort is also visting place in the city. In agra there are many hotels/accomodation as per as visiter demand. There are various hotels that are 5 star where visiters can feel comfortable amd also some cheap hotels and lodge where medium budget people stay. In the term of safety, agra is safe place the locals of agra arw sweet and talk very respectively. And there are many police stations as well as polices are avaiable at every market, traffic points and all visting places. According to me people should visit the agra and seen the historical places.so feel free about safety and reaching problem. You will not face any issue.",Agra
"Hello guys, Agra is known for Taj Mahal but nobody knows what else other than Taj Mahal could be related to Agra. I will try to answer that with my review.Agra had many hotels as it is one of the most sought after city for tourist from worldwide. But most hotels are overpriced for the quality they possess. I got a room for 1500₹ a night and it was no better than cheap 500₹ a night kind of hotel in any other less hyped city.I went to Taj Mahal and it was god damn beautiful. It is much astonishing beauty that takes you by surprise even though you already know and expect it to be beautiful. Still, it is beyond any expectation because there is nothing as beautiful and extravagant as Taj. If talking about the city, there are few other places as well such as Agra fort and few other Mughal heritage sites. But everything else is nowhere closer to admiration after viewing Taj ahead of them. I would advice to visit the Taj Mahal in the end to keep yourself involved in other places. I did the mistake and I was unable to accept any other place of any good since I saw the Taj before in the day.But I have given the city a dislije for very strong and well intented reason. Agra is very poorly organized and any random place is being used for dumping household waste in the city.Upon having a walk near around my hotel which was apparently close to the Agra Fort, I was disappointed to see the filthy and unorganized nature of city. The roads were full of potholes and the drainage system was horrible. A very unpleasant smell was extemporarily annoying me to an extent that I had to keep my hankerchief over my nose. The sewerage lines are open and asymmetrical. Add to it, the blockages on regular intervals which was making it spread all over the road at random. I have to admit there were more than 5 such incidences in between the 2 kms of walking distance after which I returned back to take some fresh air. Literally, Agra is one of the most polluted and dirty cities which I have ever seen and I say this in spite of the fact that I have been to Kanpur too.About the people over there, I will just share this incident. I reached Agra by bus. The journey in summer season is pathetic even if you travel with AC buses and much worst if the AC goes corrupt which happened with my bus. As soon as you get out of the bus at the final stop, there will be numerous auto drivers pulling you physically as if you are their friend. Two of them started pulling my either hand and before I could react to their protuting behaviour, theywere already fighting for the rightful one to have first approached me. I shrugged both of them to move further and take my time to plan what to do next. But as I stepped across them, there were innumerable other Auto drivers ready to catch me. It was terrible to get out of those crooked drivers. They were asking for unreasonably higher prices and every person had one hotel to recommend which according to them, was the cheapest and best. I had to call one of my friends lived in Agra then, and he helped me out with the hotel and all other things. No local man was interested to help, either due to the fear of those auto driver's union whom I bashed verbally or may be they saw no profit in helping me. The place was not friendly at all.",Agra
I Had Visited agra with my friend and brother six months ago this place offers you the different natural beauties and monuments but the thing Makes  Agra so Special is The Tajmahal as all of you already know that its the symbol of love but its more beautiful in its own. Everybody have to visit there atleast once. Expense- The Overall Touring packages are really cheap and the Food is also in budget. The Local taxi association offers you 6hrs sightseens for only 800 Inr and 4 hrs sightseens in 500inr only. So we Can say the Travelling expense is overall under budget. Sightseens- There Are Major Five kind of Sights available there to see.   1. Tajmahal.  2. Redfort.  3. Mehetab bag.  4. Local sweet market( petha speciality) 5. Mini structure of tajmahal for night view Agra offers u decent amout of space and peace. Its is an ideal weekend tourist place for family and friend. Thank you,Agra
Agra is the very old city of india very popular city of india in other words many people's says that mughal city because 800 year mughal emperor kingdom was there in agra and one of the most beautiful things are located in that city TAJ MAHAL the seven wonder of the world one is our taj mahal in my experience I am saying that Taj mahal is very very beautiful to see when u see continuously you can't able to blink your eyes just think how much the taj mahal is beautiful I go last year only agra and I am very happy and excited to visit taj mahal and I finally visit and see.,Agra
"I Went agra many and many times.every time I went to agra, I went from New delhi because I visited with my family and laws who resides in delhi.There are a multiple accessibility to access this city.Basically Agra is known for it's historical identity. ""The Taj mahal"",the 7th wonders in the world is the prime attraction of the city.during the mughal empire, the fifth mughal emperor saha jahan built this dedicating to his wife Mumtaj. The Taj mahal is spectacular guys still today.I recommend every people to visit Taj mahal even for a single time in their lifetime.This is the beauty about agra.This is the city of Historical Monuments, so, Apart from the Tajmahal, You can visit Agra fort, Jama masjid, Fatehpur sikhri, Dewani-khas, Bullan darwaja, Akbar's tomb, Mariama's tomb, keetham lake and many more. So these were the positive sides of agra. But it has some negative sides also, Like As This city is so much populated, so you will find the roads, the railway track, and the other side of the city much dirty.you will have local transportation system available normally but most of the times these are so much crowded during the day.this is one of the crowded place.And you will find a lot of dirtyness all over it.One more thing that you need to be alert about, As this is one of the very common tourists place in India, So people over here are always ready to make benefit from you.You will have a variety of foods place here according to your budget.There are quality restorants and the Middle-class food shops are available both.But, I recommend strictly to not have street food here. Overall, I recommend people to visit agra and feel the magic of beautiness of there.It's indeed a place to visit. Thanks",Agra
"We have been to Port Blair(Andmaan &Nicobar Islands) from 14-Jan-12 to 19-Jan-12 and as I thought it was / will be an unforgettable journey for  us. We 30 ladies of group of friends went to Andaman trip. It was amazing experience. After staying for 2 days in Port Blair we went on a stay for 3 days to Havelock Islands which is about 2 hours cruise ride from Port Blair and we stayed in a resort called Symphony Palms. Another lifetime unforgettable experience that we had at Havelock island. Staying in a wooden cottage just next to sea is all I can ask for where we actually got a sense of pure leisure. It's a great place to visit, blue sea and peace are the USP of this island. Radhanagar beach is a real beauty. the beach is so clean that you can't find such beaches anywhere in India that's for sure. we had a very good time at Port Blair, Havelock island and Neil Island. there are three ways to reach havelock island - govt. ferry, private Makruzz or Sea Plane. The days are mostly sunny at this time of year, and the sea sometimes flat enough to reflect the clouds. The monsoon usually hits around late May, lasting until the end of July, and is probably the worst time to visit the island – strong winds, frequent rain and low visibility underwater. Radhanagar Beach(Beach #7) is the most beautiful on the island and was rated as the best in Asia by provides welcome shade looks out over turquoise water, some stretches with a sandy bottom good for swimming and some with excellent coral reefs that are great for snorkelling – a great combination indeed. Sunsets here are often spectacular and it's a popular time to be at the beach, but be careful not to miss the last trucks back if you're not staying here. Havelock also has some good resorts, a night halt here is recommended.",Havelock Island
"I rarely write negative reviews. I am the glass is half-full type of positive, bubbly happy-go-lucky person. But somethings make you so frustrated that you want to scream your lungs out. My trip to Agra and the Taj Mahal was one such experience. Go on, read more. So in Dec. last year, a very good friend and I decided to visit Agra together. When he agreed, my excitement and anticipation level went up. It was a dream come true but for what? Agra is POORLY connected with the rest of india. The airport there hardly has any flights and the only option for international travelers is the often bumpy and rough ride which kills you, from Delhi by road. The last 5 miles in Agra to reach the Taj Mahal is a maze through slums, shanty towns and congested streets. When you finally reach the taj complex, you're greeted by filth, animal excreta stench and ""tourist guides"" ready to take you for a literal ride. Getting inside the Taj is a nightmarish experience and if you reach on a holiday or a Sunday, God will bless you for your patience. The security guys are polite but almost behave like they want to insult you for anything that they can find on you. The Taj is an over hyped monument whose fame is like the Emperor who has no clothes. No genuine restrooms, no recreation facility no restaurant. The area in and around teh Taj can be compared to the lack of infrastructure in the Sahra deserts of Africa. Besides 2-3 ""five"" star hotels in Agra, there's hardly any middle-class decent accommodation. I am middle class and I cannot afford to pay Rs. 10, 000 a night at the Taj. Am I to suffer because I am not rich? My advice: Don't visit the Taj if you are not a big fan of architecture. Avoid Agra like plague. And please write, email, call the various governments to clean Agra, build better road and provide better tourist infrastructure. Will love your comments and do check my new profile page. My only positive point from the whole journey was I got to spend some time with my friend. Kaajal",Agra
"I was travel in agra two times first it was october 2016 and second was march 2018 but I want to travel to agra more and more and more agra is very beautiful and safe city of middle of the India here is a large number of historical palace to travel in any season agra is also known for city of taj mahal taj mahal is seventh miracle of world but not only taj mahal here are a large number of beautiful and historical palace - lal qila , jawahar bagh and many more and the people of agra is very helpful and mostly honest agra is also well known for its very tasty foods and I eat here my lifes most tasty and delicious dishesh and its located in near delhi so you can find many trains in twenty four hours agra is fullfill with beautiful nature and when you come here then dont be miss the famous of here it is very testy and good for health i am very happy to share my experience of agra city and invite every one to visit this city",Agra
"I had lot of expectations, have visited Agra 2 weeks back. Taj Mahal looks good, but not as much as the hype created by someone, also everywhere starting from Cab drivers in Agra Canteen railway station(they threaten, fight each other etc Shopping centers(no proper bill with GST etc), many shops they say they are run by UP Govt, but please google and check with UP Govt helpline if you really want to shop) Many small hotels, even sweet shops who sell Petha(there is no expiry date, MRP etc and no fixed price and if you are good in bargaining, you get better price, even for food, sweets? Yes! Except big shops and in airport, they provide proper bill and the sweets quality is good I felt that the intention is to loot/cheat the tourists and earn money as much as possible which is pathetic. 5.Hygiene around Agra - again pathetic It's known the tourist spots are like this, but this is the first time I had very bad experience. Also, be careful of anything you buy from street shoppers near Agra, even Delhi because they quote 10-12 times price (Example. Taj stone toys, they will say INR 400, if you bargain well, you may get for 50 bucks! I am serious. Pretty much, same scenario near India Gate, Delhi also, but not as bad as Agra. Hope this review may help someone, also if someone from Govt reads, they may do something about it?",Agra
"The Tuljabhavani Temple is a very old temple from the times of Sri Rama. Shivaji the great ruler, was a great devotee of the diety here, and would always take her blessings before going out for any wars. This temple is having a jagrut deity, that means one can feal the vibrations of the diety if one is pure and close to divinity. There is a power which can heal or give solace to any problem. When Rama was on his search for Sita, on her abduction by Ravana, he had stood here and asked for directions. It was then that the goddess appeared and showed him the way. When she appeared, He had said 'Tu Ka Aie'. Meaning Is ist You Mother. Tu Ka Aie became Tulja and mother became bhavani. There is stone here which sugests that ur worry will be resolved or not. One has to keep one's hand over it. If the stone moves to the right, work shall be done,  if it moves to left, the answer is no. This stone has a scientific principle and it works on the basis of one's subconscious state of mind, feeling the positive or negative vibrations from a person.  One should surely try it. This diety is a kuldevi or family diety of many people in Maharashtra, Gujarat, Karnataka and AP. Blessed are the souls who have her grace, do visit it once and get grace showered on you. The divine will will help you rech there, and garness her blessings.",Tuljapur
"Filthy and highly polluted city. No development, no infrastructure, no roads, no flyovers, no good traffic means, no rule & regulations with worst peoples.",Agra
"Hi, Today's topic is Agra. Friends as we all know that Agra is famous for Taj Mahal. Yeah, I travel to Agra for a visit of Taj Mahal. That was my first time to visit Taj Mahal. Agra is very nice place and Taj Mahal is very beautiful palace. I travel with my friends and we rest in hotel delux plaza. That hotel was awesome. Yeah I enjoyed very much. Agar is a safe place to survive. I did not want to leave agra but the happiness is always in the house. Aftet 6 days of tour I came back to my home sweet home. Thanks.",Agra
"Last week I visited agra as a part of faculty tour. Few things which I noticed very common over there was people looting the tourists, doesn't matter whether its indian tourist or forrigners. They ask for thrice or four times and even more price if they see some new tourists. It was te case not only at tajmahal only but also at public places like railway station, bus stands etc. Second thing is that the city is very much polluted. I still remember when we were in train and asking each other how much time would it take to reach agra. Then one of us told that the moment when you will be unable to breathe without keeping a hanky on your mouth, understand its AGRA. And the same happened. Of course the tajmahal was best. We captured good memories. The sweets like pethas were awesome but what remained in our memory is the dirtiness over the city and people looting the tourists.",Agra
"I went to Delhi for a wrestling national level competition. After my wrestling mach, I wish to travel all the places near to Delhi. From there first I gone to Agra redfort. It was soo beautiful and excited me. Redfort now also looking like a place. Some of the areas are restricted to us. We can walk around the redfort through the alloted area. After visiting redfort, I travelled to see Thajmahal. I seen Thajmahal on in videos and pictures before I reach there. I don't know how to explain the beauty of Thajmahal. The construction and the materials used to build Thajmahal made me to think about to legendary people lived in that period. If anybody wish to see Thajmahal, don't wait. Go as early as possible. You never disappoint about the travel. I am soo happy to see Thajmahal.",Agra
"Tuljapur is very much popular temple in  Maharastra, though it is not very much well known  as Shirdi for example. I did not know about this temple about two years ago until my driver suggested that we must go via Tuljapur to Shirdi. At that  point I said yes to him but did not ask much . He explained that  it was chatrapti Shivaji's  ""ila velpu""  meaning  the goddess he worshiped. And finally when we were going to Shirdi , we skipped the route  to Tuljapur , because somebody we asked on the way told that  Shirdi via  Sholapur is better , and  the  road via Tuljapur was bad .  I did not care and told the driver to go straight to  Sholapur. I convinced myself that I did not make promises to go Tuljapur and I did not break it either, But the Goddess seems to have got  angry , and she punished me . At  Sholapur chowrasta , the corrupt police harassed me for one  hour in hot summer  and collected 300 rupees ""mamool""  bribe from me on some flimsy reason that  there is no pollution certificate , it was my new  car and I did not  take pollution certificate . That one year period was over by just one week they argued and said I should pay one thousand rupees fine, Later I learnt that  sholapur  police are experts in harassing Shrdi going piligrims and it was very common for the sholapur police to loot the piligrims. All this happened I thought was because in the last minute , I canceled my plan to visit  Tuljapur. After two years when in November,2007 , I was driving my car myself , I did  visit Tulajapur Bhavani mandir.  It was on Hyderabad to  Bombay  highway , you will  see  a very big Board by R&B department indicating , that  a right turn at the ""Y""  junction takes you to Tuljapur. If you were going  to  Shirdi  from  Hyderabad , you need not come back  to  this ""Y"" junction again  to go to Sholapur and from there to Shridi. You can continue your journey from Tuljapur  to Shirdi. The road up to Tuljapur is really very good. But from  Tuljapur to Shirdi , only some  parts of the road  is terribly bad  so  much so that you would  think your car  shock absorbers ,even axle rod would be broken. But  this road is presently under repair on a big scale. This time  November second week  when I visited  Tuljapur , what I expected and what I saw was very different. It was a huge temple  ""gopuram""  the main entrance that attracts you.  It was really a huge construction. Inside as in many temples all is in quandary. touts harass devotees ,perticularly the first timers at will. They misguide you telling that they would take you closest to the deity , and  normal  darshan in the queue would be quite a  distance from the main deity,.They asked us Rs.300/  and rhen someone asked only 150 or some amount like that. Yet another one explained that you would give that amount as donation  to the temple and take a receipt as well. The people  in the queue advised us to stay in the queue and the darshan of the deity would be just the same. We stayed in the queue and really darshan of the main deity Goddess Durga Bhavani , is just the same. The distance is almost similar for those who paid to the touts and to us. Like monkeys  the touts swing on the queue shed iron rails and jump up and walk on the rails to come out of the queue line , and again probably try to attract some other devotees. There is a very big courtyard , once you cross this huge main entrance gopuram. On the right side , if you choose to go , you would walk through water flowing in a stone room and come out of it. After visiting Ganesh , You would walk through another entrance and in to a very huge courtyard with neem tree. You will see  many villagers,newly married couples as devotees. The actual sanctum  is a small temple. The main idol is very attractive . you will not forget  Tuljapur Durga Bhavani, again in your life time, Priests behave very well. Even with that much rush, you can see Goddesss Durga for much time as you would be coming out in a direction which facilitates to see her all along while coming out.  ""Durga "" , you would  feel her presence. There is something very spiritual about this temple, I thought  to myself while coming out. The priests put sindur on my forehead very wide. I did not any see any stone where devotees feel vibration etc., as described in other reviews.",Tuljapur
"Hi guys, l share this review. I went Agra, and I first visited on taj mahal.taj mahal is very best, historical and tourist place. This area is very wonderful area.Agra is famous between taj mahal. And its management is very good.l said taj mahal is a country a wonder in the world.its enhanced yamuna river inshore.and its year construction of 1631-1653.its built by shah jahan.and beautiful garden he is set up.",Agra
"Tuljapur is great place in india.in tuljapur the stachu of tuljabhavani. In tuljapur the entry are in a large door then the great and larger temple of tuljabhavani.the nature of tuljapur is very good .and it's very good for health also.the climatic a rea of tuljapur is very graceful.and good for the health.in winnter the good climate and very enjoyning.that time.many trees , animals are also available their.many tourist are visit that place.many citizens are visiting tuljapur.so visit u also that great place.",Tuljapur
Tuljapur is especially famous for thre goddess Aai Tuljabhavani.Tuljapur is a town with a municipal council in Osmanabad district in the Indian state of Maharashtra. Accessibility-state transport buses from osmanabad and solapur no railwaystation and airport directly. site seeing-tuljabhavani temple poor hotels and Accommodation facility.not too much effective. you should be careful from thiefs.otherwise good,Tuljapur
Hi friends iam going to share my experience in tuljapur. I have visited to this place last year with my family members.There is a one temple namely called tulja bahavani temple which is a we need to visit and also we have some other places like bidar narasimha Swamy temple as well to we have stayed in an hotel for a night tukjapur facilities are good we can enjoy some outside places to shop as well.so plan today and go for a devotional time with your family members.,Tuljapur
"Hello friends Today I share my personal experience about agra trip.agra is a historical place.agra located in Uttar pradesh.the taj is very beautiful it appeared to be silver white.it was built by king shah jehan in the sweet memory of his wife mumtaaj. Local sightseeing : -here local sight seen is so good. Where to stay: - many famous hotels are situated in agra. Hotel trident agra, hotel crimson palace, radisson blu hotel agra, given best facilities.these hotels are available on very  low price. Shopping center: -many famous mall are situated in agra some mall name ashok cosmos mall, omaxe wedding mall, tdi mall, pacific taj mall is so large.these mall are best for purchase. Other famous place: -agra fort , agra panch mahal, skinadra fort, anguri bagh is also famous place in agra.these place are most beautiful in agra. Safety: -this place is fully safe for visitors because here is no crime.this place is good for you if you go want any trip. Thank you",Agra
