review,place
Hello everyone today I want to share you the experience of my tour which I had in last week to Hyderabad. I had a great experience this is a small city situated in Telangana Andhra Pradesh. There are many fabulous things to do in Hyderabad. One of the best thing which I experienced was the Snow World in Hyderabad the entry fee of Snow world is 500 rupees but it is worth as it is giving us an awesome experience. The next famous all time favourite thing of Hyderabad is the Hyderabadi biryani. The one and only one the famous Paradise hotel for biryani. Hyderabad is also known as city of pearls. And also is important for its great historical significance. One of the best historical significance of Hyderabad is the Charminar. Charminar is situated in the middle of the city in the busy market. The next important historical significance is Golconda Fort it was the best historical place which I have seen as the architecture building and construction of the Fort is mind blowing even the decorations and architectures of that time are still there. So this was a great experience for me to be in Hyderabad and I would suggest you you can have a trip to Hyderabad and enjoy thank you.,Hyderabad
"Hello people, I am from Andhra Pradesh.Earlier to 2015 Hyderabad is the capital of AP, now it is capital of Telangana.Hyderabad is a city built by Navab Hyder Ali As a monument for total abolition of plague from them, at that time.So many old places like Golkonda Fort, Charminaar well known place to everyone, Salarjung museum, etc., Hussain sagar is the biggest lake in Hyderabad.Buddha's statue is placed centre of hussain sagar.So many visiting places are there, we can get telgana tourism buses and roam across the city, This is not only ancient city, very updated city.Cyber city, IT park, high court like,  everything in the country can be observed in hyderabad.Reaching to Hyderabad is by road, train, flight will be convenient",Hyderabad
"Hyderabad - A Historical Tourist Spot for Telugu States Hyderabad - If we heard the name from any one immediately we the Charminar will be visible in front of our eyes.  That is the importance of Hyderabad in whole world.  It is situated along the banks of Musi river. Now Hyderabad city is the capital of Telangana state and temporary capital of Andhra Pradesh State w.e.f. 2014 which the Andhra Pradesh State separated as Telangana & Andhra Pradesh.  It is also called as ""Bhagyanagaram"".  Hyderabad is one of the greatest historic place in view of our heritage, culture, wonderful historical constructions, monuments, temples and mosques.  It is also known as ""City of Pearls"". At the time of ruling of Kuli Kutubsha, the hyderabad called as'Bhagyanagar' which the name coming based on the name of his wife called'Bhagamati'.  Later they converted into Islam and the name of city will be changed to Hydernagar, later Hyderabad. After independence in 1947, the Nizam agreed put several business agreements with India.  The communists have  fight with'Rajakars' who are the soldiers of Nizam state for amalgamating the Hyderabad in India.  Due to the war, the people started to go to Andhra Pradesh due to unrest.  At that time the Andhra Pradesh introduced a operation called'Polo' under the control of Former Housing Minister Sardar Vallabhai Patel.  Then 17, Sep 1948, the Hyderabad was handed over by the Indian Government by the way of police operation for 5 days.  Later Hyderabad became separate state for eight years.  In 1956, at the time of dividing of states based on language, the hyderabad will be under the control of Andhra Pradesh and also capital of Andhra Pradesh. Hyderabad is one of the largest metro city in India.  The total area comes to approximately 700 square kilometers with the 4 place in India.  After independence so many developments have been taken place like IT, Education, Hospitals, Business, Transport, Roads, Industrialization, Media, Hotels along with various great historical tourism places etc.  After 1990, the IT business was developed hugely and provided number of jobs for the IT persons.  The IT sector brought the Hyderabad to a step high in the world.  The living status of people was increased highly due to the IT sector.  It brought great look to Hyderabad in the whole world.  In tourism point of view, the other great historic monuments and places are follows here. 1) Charminar:  This is the first and important landmark of Hyderabad constructed in 1951 Mohammad Quli Qutb Shah with 4 towers along with the height of 56 m. to watch the Hyderabad. 2) Salar Jung Museum: This is the second most important museum and best southern India.  It has considered as best museum and having 50, 000 collections approximately all over the India. 3) Buddha Statue: Former Chief Minister Dr.N.T.Rama Rao fixed the one of the single rock Buddha Statue with height of 18 m and weight of 450 tons situated in the middle of Hussian Sagar.  This is one of the highlight of the Hyderabad city. 4) IT Center: Hi-Tech city was situated at Madhapur by the Former Chief Minister N.Chandrababu Naidu for increasing the financial position of people by creating jobs and also developing the business of India in the world.  There are so many international companies like Microsoft, Yahoo, Oracle, Nokia, Dell, AMD, Amazon, Accenture, etc established their offices in Hyderabad. 5) Birla Temple: Birla temple is one of the most popular temple situated in a small hill near Ravindra Bharathi at Lak-di-kapool.  The entire temple was constructed with ""pure white stone"" in the middle of the city.  Beside this temple, Birla Science Planetarium and Cine Planetarium situated.  This is very beautiful place to watch city i.e. Hussain Sagar, Buddha Statue, Assembly, Ravindra Bharathi, Lal Bahadur Cricket Stadium etc. 6) Golconda Fort: Golconda Fort is located 11 kms far away from Hyderabad.   The Golconda Fort was constructed on black stone hill with the height of 120 meters.  This is one of the wonder tourist spot in the Hyderabad. 7) Macca Masjid: This is one of the ancient mosque constructed by Quli Qutb Shah and completed the work by Ourangajebu.  Approximately 8000 labour worked for complete the construction during 77 years.  It is situated near Charminar. 8) Ramoji Film City: The World biggest film studio name Ramoji Film City was constructed by Mr.Ramoji Rao with the area of 2000 acres for the purpose of film making. 9) City of Pearls: Hyderabad city is well famous for Pearls by producing low cost. 10) Biggest IMAX Screen:  Prasads IMAX theater was situated in Hyderabad with biggest 3D screen with 72 X 95 height and width respectively with sitting capacity of 650 approximately. 11) Zoo Park: Nehru Zoo Park is biggest park in India and spreading 400 acres approximately.  It was established in 1963 october 5th based on the name of Former Prime Minister Jawaharlal Nehru.  Approximately 1500 different animals were protected under this park. In addition to the above there are many places must visit by the tourists like Purana Haveli, Birla Sanatorium, Police Academy, Assembly, Secretariat, Jala Vihar, NTR Gardens, Snow World, Lumbini Park, Tank Bund, Fly overs, Metro Rail etc. There are so many tourists plans offering by the Telangana State Government in the way of either specific packages or day pass issuing to visit such places.  Many hotels were situated to fulfill the needs of tourists.  At the same time the Telangana State Government has taken sufficient safety precautions due to bomb blasting by terrorists.  So every body must see the Hyderabad at least once in their life. Thank You",Hyderabad
"Hi friends, today I share my experiance and stay in hyderabad. I visit Hyderabad number of times, it is great experiance in hyderabad in my life. Last year I went to Hyderabad it is one of the greatest cty in india, there are so many tourist places to see in hyderabad. It is largest populated area in total telangana, most of the people who completed thier education they have to come and searching for jobs I visited the historical places there like Charminar, Birlamandir, Salarjung musium, Nehru zoological park, and Golkonda Fort There are so many hotels to stay the cost vary with hotels depending on potential. Me and my friends visit charminar it is wonderful place and design of the 4 tombs are good. There is Masjid also near to charminar we go to masjid and pray . There are no of shopping malls, and restaurents and theaters. The hyderabad police force makes very security for city people, no doubt about that. So, I recommend to people to visit hyderabad in summer with your family.",Hyderabad
"Hi everyone today I am going to share with you about Hyderabad torusit attractive places. Hyderabad is the place of several regions living together. It is the place several attractions such as musuem, Golconda fort, charminar, birla mandhir, famous malls, restaurant, parks, and also it hub. It is very easy to access this place even if you are not a Hyderabadi. You can arrive to this place through air lines, railways, road ways too. There are several sightseeing palces with good accommodation facilities. It is also the safety palace as there are no religious feelings all are one.",Hyderabad
"This is my home.   I was born and brought up here.  And no matter where ever I go on this planet I might not have the same feeling as I have on this place . . Now why I like this place . ? Well it has everything which a person wants . You have good places to chill , you have great places to explore , you have water parks , great restaurants , little bit of lakes here and there . Well if you are an night owl this place has covered you up . you have good places to eat even if it is midnight , some good streaches of roads to drive on ( but be careful ) then you have some things which have  to be seen in the dark atleats once like the iconic Charminar which lights up like a christmas tree and the buddha statue in hussan sagar . . And the food lovers this place is heaven for you people . You just need to know where to go . Some of the must eat things if you are coming to Hyderabad are . the famous biriyani , kurbani ka meetha , the haleem you get in ramzan season , irani chai and lots of stuff like this . well if you are asking where to eat all this ? Well lets start with gokul chat in koti . This place is pure heven for all the people who love chat . 'dhai puri 'amd 'dhai papdi ' ate must try things over here . Now another place which is good for food joints is sindhi colony near paradise . You will find a couple of places where you get good 'vada pav ' and 'dabeli ' . And if you are a pan lover well you have dimmys pan mahal here where you get some of the amazing pans . And for the night owls who are hungry you could try ram ki bandi in koti which is pretty famous all over Hyderabad . I know people who drive almost for 40 to 50 kilometres just to eat dosas here . One important point to note if you are going here is that it only opens from 2AM to 5AM in the night  well thats the reason why I said ' night owls ' . The dosas over here are amazing and you have to try this if you are in Hyderabad . . And if I continue more I will run out of space here telling about this place . So just to conclude fast here are some more places to visit in amd around Hyderabad. Charminar Golkonda fort The NTR gardens The necklace road The ' jalvihar ' in necklace road if you like water parks . If you wanna buy some cheap and good books koti market is best place for you . Basically koti is a place where you can grt anything . its like karol bagh of Hyderabad . You just have to know where to look for the right stuff. . Soo I am stopping here because it is already too long .  hope it was informative to you.",Hyderabad
"I am married to a kumaoni boy, every year twice or may be thrice I vist Uttrakhand. This time we ( me and my better half) explored Mukteshwar ""a place which will make u feel like you are really living and living for worth"". We did camping in Mukteshwar, it was altogether diffrent experience, I then realized mountains are not just beauty they actually pull you out from your comfort zone and when you reach the top of it and view down you then realise what a mountain can gift you. Mesmerizing 360 degree view it was, the wild adventure. I just love this place.",Mukteshwar
Everyone gets irritated......when i speak hindi....fk this city.....hindi is a National language of india man....and the faces of people enough to get u depressed,Hyderabad
"I had worked in 3 states Telangana, Karnataka, Tamilnadu.On my 2+ years of experience i feel very bad in Hyderabad. Still Andhra vs Telangana, cast feel is more in their state.Also if you are from other state like Karnataka and Tamilnadu they wont like at all.When i was working in Karnataka there is an issue with Tamilnadu still they never treat , they are respecting other state people also giving value to their own state.As Andhra guy i feel people of telugu must change.When you guys come to Tamilnadu and Karnataka they are welcoming you whole heartedly , please learn from them. Most jealousy people.",Hyderabad
"As you all know that Bhangarh is a government approved haunted place in India known for paranormal activities there. My trip to Bhangarh is my most thriller experience trip in Bhangarh. The place attracted me because of its popularity and old story related to ghosts. I was not able to see or feel any paranormal activity there, may be the reason is that I was in Bhangarh in the day. Besides the story and horror, that is a nice place to visit, gives you a good experience with ancient arts and the fort is quite good to see. Night stay is not allowed due to security reason. I interact with the nearby peoples who told me the story of bhangarh and about the cases happened there. If you are searching places to visit in Rajasthan then you can add Bhangarh to your wish list.",Bhangarh
Mukteshwar is pleasing destination situated in Uttarakhand. I visit Mukteshwar last year suck a pleasant weather every were. July is the rainy season in Mukteshwar so every were is full of green. From Mukteshwar The hills of Himalayan shown. In Mukteshwar 350 years old Load Shiva Temple is very famous. Everyone go there. The beauty of Mukteshwar is unpolluted and unaffected till date. It is belevied that Load Shiva kill a demon at this spot and he granted him Mukti. Mukteshwar has quite a few restautrants. In Mukteshwar is full of family spot and you can do also camping and rock climbing. When you go Mukteshwar please do camping because the unspolied beauty of Muskteshwar has a lots of offers. Wake up the chriping of birds and Sun rays kiss. Guys You have to go Mukteshwar once in a Life.,Mukteshwar
"For years, I  was told about Bhangarh is known for its stories. In March, 2016 I had planned for a tour to Bhangarh wuth my friends. It was good experience knowing the stories and meeting people there. Somehow, it looks like dangerous place and the might have some solid evidence, therefore the government of India has declared it as one ofvthe most haunted places of India. The entry in the fort after 5 in the evening is strictly prohibited. That is very excellent place and has many hidden stories behind it. I would prefer you to go and expore on your own so that you can decide according to your experience whether the place is indeed haunted or not. Do wear leather shoes or some good quality shoes before going there because that is very hilly area, and try to keep that beautiful place clean.",Bhangarh
"This city was famous earlier because of enormous charms and beautiful tourist spots.But now it's not at all the same.The reality is as below., 1) Mosquito city.you will find lot of mosquitoes all over Hyderabad and people are getting sick because of Dengue and Malaria like symptoms all over city. 2) Very Un-Hygienic city in terms of cleanliness.it's one of the dirtiest city in India.you can't even think of going in public toilet. 3) No transport facilities especially to  High-Tech City area where most of the IT companies are located. 4) Lot of dirt, pollution and accidental roads everywhere.no proper drainage systems so water keeps on accumulating producing multiple diseases in city .no healthy measures.",Hyderabad
"Bhangarh Fort is a historical memorial built by Raja Madho Singh in 1631. The fort is located in the primordial town of Bhangarh, which lies 40 km from Jaipur and is about 300 km from Delhi. According to  stories, no one is allowed to enter the fort premises once the sun goes down. several incidents where nomads or volunteers opted for a night stay in the fort, but never made a return from the fort the next morning. Therefore, strict restrictions have been imposed; you have to leave the fort premises before dusk. The main entrance to the fort is locked and remains out of harm’s way till the next morning. local sightseeing is awesome as fort. near local village shop for shopping. hotel/accommodation is not available bhangarh, only in alwar delhi highways. safety is most import which not safe after sunset. please  to leave the fort premises before dusk.",Bhangarh
"The Ruins of Bhangarh fort are small and highly overrated about the supernatural stuff. It takes about 3 hours to visit the place from alwar. Due to its remote location and poor road connectivity, it is recommended that one reaches the fort by 1200-1300 hours and leaves by 1630 hours. Do carry snacks and drinking water. There is no need to hire a guide inside the fort as its not such a massive place and trust me going bhangarh in day time is such a waste of time because you wont feel any such thing in day time",Bhangarh
"I visit bhangarh and I think that must be 100% haunted. But I does not feel any paranormal activity there. I talk to nearby people , but they said old stories. Any single person is currently not present there who say that I saw or hear something there. I also did not see or hear anything there. Some area of the fort are dirty and it smells very bad. The management of the fort is not so good. It needs improvement. The haunted tales of bhangarh is really good but they are very old. Now I think there is no ghost there.",Bhangarh
"Being a Hyderabadi, I visited a number of places including Gol Conda fort, Hitech city, several nizam palaces, Hussain sugar, Imax, Charminar, Medak church, Salar Jung Museum and many others. I always give preference to watch a big Hollywood movie in Prasad's multiplex in the Imax format because of its screen picture quality presence and sound intensity. This screen is treated as a second biggest screen in Asia. And also loves to visit NTR gardens to goof around. Gol Conda fort is one of the main assets for Hyderabad. It simply reflects the grandeur image that Hyderabad had in its medieval period in terms of art, architecture and engineering skills. There is a myth about that fort which relates to Hindu mythology and happened during a medieval Hyderabad Nizam period, that Lord Ram along with Laxman visited the fort in order to free his devotee Ramadasu. The fort is one of the biggest of its kind and expanded to several kilometers, and there is also another myth , old people say that if we dig near Golconda fort we will be lucky enough to find diamonds ( I don't think its a good idea, it might be a general myth ) telling us that, during that period Hyderabad was filled with abundant gold and diamonds. Near to Golconda, there is another monument called taramari baradari. there is another palace called queen bhagmathi palace and it is said that the Hyderabad was a gift to that queen and there was also a telling that she was the most beautiful women in south India during that period and her beautifulness was always compared with the brightness of the full moon, by the pandit poets. The palace is situated on top of a hill and the architecture involved was in a  Persian style. Later I would like to tell about the iconic Charminar which is the landmark of the Hyderabad. The city is also called as pearl city. The Charminar was constructed around 1700 to give tribute to the people who were affected and fought with deadly plague disease. The Charminar is located in old city of Hyderabad. There is a mosque called Makkah Masjid. It was constructed with full of unique architectural style. There is another mosque which was constructed with Spanish engineering skills called Spanish mosque. Hussain Sagar is also the main attraction to Hyderabad. The Buddha statue located amid of water is a treat to watch. The parks around it give a lively feel. Salar Jung Museum is one of the finest museums in India. It is also the biggest one. It has several collections of artifacts about Hyderabad Nizam kings. Nehru zoological park is also biggest of its kind. It has a variety of collection of rare animals. The plantations, gardens, and animals inside this park leave an irreplaceable mark about mother nature in our mind. There are several palaces of different nizams covered around the city. Yadgiri gutta, which is a sacred place for Hindus, and it is a Devastanam of Lord Narasimha. The temple is situated on a hilltop. Near to this temple, there is a fort called Bhongir fort which was treated as a border for Nizam dynasty in the medieval era. It is located on top of the stone hill. By seeing that fort, everyone will get a doubt that how on earth that fort got built on that kind of hill. It is tallest and seems to be bigger in size. We can find many cannon ball shooters there and guns that were used by the army of Nizam. Hitech city is the hub for software industry which ranks second in terms of software delivery to the world and places next to Bangalore city. Medak church is the tallest church in Asia. The designs and paintings on the walls of that church will let you be in spellbound. The church is simply mesmerizing beauty and art. During Christmas, it will become the busiest place on earth. I am proud to be Hyderabadi and always be. Badminton, Bussiness, Bahubali, Biryani are special in Hyderabad.",Hyderabad
"As I am fond of new things and If it has sime believe then I am fond of it. To know Bhangarh is one of them and I have planned to visist the place. We went from delhi by Bike and reached there.looks like a beauty of jungle surrround us and the beauty if that old fort is amazing.We dont feel as horror as beauty is but thats the great place to visist.Talk about it features seems many people died and their spirt is there.But u can feel the horror in night and we are not allowed to stay there So we went jaipur to stay.Next morning we came, and seen many temples, huge trees and villager still believe that trees and temple is just for to avoid these spirits We can only feel the horror at night .but nice place to visit.",Bhangarh
"Bhangarh Fort, one of the most haunted places in India. Locate at the Aravali Hills in the deserted area. Bhangarh the city which remains are left over is between Jaipur and Alwar.  There are many stories related to the ruined city. Aprox. 278 km drive from Delhi, Bhangarh fort which is guarded by the Police and archaeological survey of India is a place to visit once in a life time. Bhangarh Fort which was once six storey palace now, remains just two storeys. Bhangarh Fort surrounded by wall all four side. The fort included demolished houses, market places and the only thing that remained intact was the temples inside the premises of the Palace. There is lot to see and explore in Bhangarh as said by the Locals there. I would say one day trip is enough for the most haunted place in Asia. However, the trip was worth for me. Please visit during day time only.",Bhangarh
"Hello friends, we already know that Bhangarh is famous as hunted place. Last time I have visited there. It was not good place. There accessibility not good as I have expected. There I did not get any vehicle. I have go my personal car. I have visit there with my friend. Hotels are in high range. And there everything in higher range. It is expensive too much. There is no safety in bhangarh. There local sightseeing is also not good. I would recommended this place to anyone.",Bhangarh
